{
  "$schema": "http://json-schema.org/draft-07/schema#",
  "title": "pester-promotion-comparison@v1",
  "type": "object",
  "required": [
    "schema",
    "schemaVersion",
    "generatedAtUtc",
    "baselineLabel",
    "candidateLabel",
    "decisionState",
    "comparisons"
  ],
  "properties": {
    "schema": { "const": "pester-promotion-comparison@v1" },
    "schemaVersion": { "type": "string" },
    "generatedAtUtc": { "type": "string" },
    "baselineLabel": { "type": "string" },
    "candidateLabel": { "type": "string" },
    "decisionState": { "type": "string" },
    "summary": { "type": "string" },
    "comparisons": {
      "type": "array",
      "minItems": 1,
      "items": {
        "type": "object",
        "required": [
          "comparisonId",
          "packId",
          "representativeness",
          "requirementCoverage",
          "baseline",
          "candidate",
          "observedDeltas",
          "decision",
          "nextAction"
        ],
        "properties": {
          "comparisonId": { "type": "string" },
          "packId": { "type": "string" },
          "representativeness": { "type": "string" },
          "requirementCoverage": {
            "type": "array",
            "items": { "type": "string" }
          },
          "baseline": {
            "type": "object",
            "required": ["workflow", "runId", "runUrl", "headSha", "ref", "conclusion", "packIdentity"],
            "properties": {
              "workflow": { "type": "string" },
              "runId": { "type": "string" },
              "runUrl": { "type": "string" },
              "headSha": { "type": "string" },
              "ref": { "type": "string" },
              "conclusion": { "type": "string" },
              "packIdentity": { "type": "string" }
            },
            "additionalProperties": true
          },
          "candidate": {
            "type": "object",
            "required": ["workflow", "runId", "runUrl", "headSha", "ref", "conclusion", "packIdentity"],
            "properties": {
              "workflow": { "type": "string" },
              "runId": { "type": "string" },
              "runUrl": { "type": "string" },
              "headSha": { "type": "string" },
              "ref": { "type": "string" },
              "conclusion": { "type": "string" },
              "packIdentity": { "type": "string" }
            },
            "additionalProperties": true
          },
          "observedDeltas": {
            "type": "array",
            "items": { "type": "string" }
          },
          "decision": { "type": "string" },
          "nextAction": { "type": "string" }
        },
        "additionalProperties": true
      }
    }
  },
  "additionalProperties": true
}
